{
  "schemaVersion": 1,
  "name": "analyze-causal-inference",
  "status": "qualified",
  "packageDigest": "sha256:a74c60fc2817608c2121303a644e42e2de255161257f884b42e6a48be84b2011",
  "evaluator": {
    "name": "Sylphx Qualification Runner",
    "kind": "host",
    "uri": "https://github.com/SylphxAI/skills/blob/main/docs/QUALIFICATION.md"
  },
  "qualifiedAt": "2026-08-11T05:35:58.786Z",
  "expiresAt": "2026-11-09T05:36:13.595Z",
  "evidence": [
    {
      "id": "analyze-causal-inference-compatibility-2026-08-11T05-27-02-454Z",
      "kind": "compatibility",
      "digest": "sha256:7b269943d7bb5a0c95736d9e3410fa987e570c78422e5a2f5e25ffa4fcd1ad73",
      "uri": "docs/qualification/evals/analyze-causal-inference/run-2026-08-11T05-27-02-454Z/report.json"
    },
    {
      "id": "analyze-causal-inference-activation-2026-08-11T05-27-02-454Z",
      "kind": "activation",
      "digest": "sha256:7b269943d7bb5a0c95736d9e3410fa987e570c78422e5a2f5e25ffa4fcd1ad73",
      "uri": "docs/qualification/evals/analyze-causal-inference/run-2026-08-11T05-27-02-454Z/report.json"
    },
    {
      "id": "analyze-causal-inference-automated-pattern-scan-2026-08-11T05-27-02-454Z",
      "kind": "automated-pattern-scan",
      "digest": "sha256:7b269943d7bb5a0c95736d9e3410fa987e570c78422e5a2f5e25ffa4fcd1ad73",
      "uri": "docs/qualification/evals/analyze-causal-inference/run-2026-08-11T05-27-02-454Z/report.json"
    }
  ],
  "compatibility": [
    {
      "environment": "codex-cli 0.147.0 (agent task)",
      "result": "verified"
    },
    {
      "environment": "node >= 20",
      "result": "verified"
    }
  ]
}
