{
  "schemaVersion": 1,
  "name": "model-security-threats",
  "status": "qualified",
  "evaluator": {
    "name": "Sylphx Qualification Runner",
    "kind": "host",
    "uri": "https://github.com/SylphxAI/skills/blob/main/docs/QUALIFICATION.md"
  },
  "qualifiedAt": "2026-08-11T05:05:23.354Z",
  "expiresAt": "2026-11-09T05:05:58.732Z",
  "evidence": [
    {
      "id": "model-security-threats-compatibility-2026-08-11T04-52-11-042Z",
      "kind": "compatibility",
      "digest": "sha256:89227b8fd3f0fabcfae0b1c21455e53a91fbe1d5860ef3cecd2846d07dd546f4",
      "uri": "docs/qualification/evals/model-security-threats/run-2026-08-11T04-52-11-042Z/report.json"
    },
    {
      "id": "model-security-threats-activation-2026-08-11T04-52-11-042Z",
      "kind": "activation",
      "digest": "sha256:89227b8fd3f0fabcfae0b1c21455e53a91fbe1d5860ef3cecd2846d07dd546f4",
      "uri": "docs/qualification/evals/model-security-threats/run-2026-08-11T04-52-11-042Z/report.json"
    },
    {
      "id": "model-security-threats-automated-pattern-scan-2026-08-11T04-52-11-042Z",
      "kind": "automated-pattern-scan",
      "digest": "sha256:89227b8fd3f0fabcfae0b1c21455e53a91fbe1d5860ef3cecd2846d07dd546f4",
      "uri": "docs/qualification/evals/model-security-threats/run-2026-08-11T04-52-11-042Z/report.json"
    }
  ],
  "compatibility": [
    {
      "environment": "codex-cli 0.147.0 (agent task)",
      "result": "verified"
    },
    {
      "environment": "node >= 20",
      "result": "verified"
    }
  ]
}
