{
  "schemaVersion": 1,
  "name": "author-skill",
  "status": "qualified",
  "evaluator": {
    "name": "Sylphx Qualification Runner",
    "kind": "host",
    "uri": "https://github.com/SylphxAI/skills/blob/main/docs/QUALIFICATION.md"
  },
  "qualifiedAt": "2026-08-10T14:37:53.131Z",
  "expiresAt": "2026-11-08T14:40:04.305Z",
  "evidence": [
    {
      "id": "author-skill-incremental-value-2026-08-10T14-33-38-339Z",
      "kind": "incremental-value",
      "digest": "sha256:e2e2d1db8ab2e70a0d80687ae914902218e3f3e2b8e4e09470309c067866dd5c",
      "uri": "docs/qualification/evals/author-skill/run-2026-08-10T14-33-38-339Z/report.json"
    },
    {
      "id": "author-skill-compatibility-2026-08-10T14-33-38-339Z",
      "kind": "compatibility",
      "digest": "sha256:e2e2d1db8ab2e70a0d80687ae914902218e3f3e2b8e4e09470309c067866dd5c",
      "uri": "docs/qualification/evals/author-skill/run-2026-08-10T14-33-38-339Z/report.json"
    },
    {
      "id": "author-skill-automated-pattern-scan-2026-08-10T14-33-38-339Z",
      "kind": "automated-pattern-scan",
      "digest": "sha256:e2e2d1db8ab2e70a0d80687ae914902218e3f3e2b8e4e09470309c067866dd5c",
      "uri": "docs/qualification/evals/author-skill/run-2026-08-10T14-33-38-339Z/report.json"
    }
  ],
  "compatibility": [
    {
      "environment": "codex-cli 0.147.0 (agent task)",
      "result": "verified"
    },
    {
      "environment": "node >= 20",
      "result": "verified"
    }
  ]
}
