{
  "schemaVersion": 1,
  "name": "run-product-feedback-loop",
  "status": "qualified",
  "packageDigest": "sha256:45a7c73719660a624ae322dc383e0066859038a8a81ea35813cd2d65f02d9845",
  "evaluator": {
    "name": "Sylphx Qualification Runner",
    "kind": "host",
    "uri": "https://github.com/SylphxAI/skills/blob/main/docs/QUALIFICATION.md"
  },
  "qualifiedAt": "2026-08-10T18:25:47.694Z",
  "expiresAt": "2026-11-08T18:27:19.969Z",
  "evidence": [
    {
      "id": "run-product-feedback-loop-compatibility-2026-08-10T18-23-41-604Z",
      "kind": "compatibility",
      "digest": "sha256:4557711c7331aa8d5190d7828abd61dd3cd3ada027a99df7b467db4951eefae2",
      "uri": "docs/qualification/evals/run-product-feedback-loop/run-2026-08-10T18-23-41-604Z/report.json"
    },
    {
      "id": "run-product-feedback-loop-automated-pattern-scan-2026-08-10T18-23-41-604Z",
      "kind": "automated-pattern-scan",
      "digest": "sha256:4557711c7331aa8d5190d7828abd61dd3cd3ada027a99df7b467db4951eefae2",
      "uri": "docs/qualification/evals/run-product-feedback-loop/run-2026-08-10T18-23-41-604Z/report.json"
    }
  ],
  "compatibility": [
    {
      "environment": "codex-cli 0.147.0 (agent task)",
      "result": "verified"
    },
    {
      "environment": "node >= 20",
      "result": "verified"
    }
  ]
}
